,dates,headline,section_name,abstract,Format_date,Tag
0,2003-07-31T05:00:00+0000,Toronto Turns On Rock to Drown Out SARS Fears,World,"Huge rock concert is held in Toronto, Ontario, organized in part by government with goal of proving to world that SARS no longer poses threat to those wanting to visit; when World Health Orgn issued travel advisories for Toronto, it prompted massive cancellations of conventions, concerts and vacations; more than 430,000 people crush into stadium to hear Rolling Stones, Rush and AC/DC perform; photo (M)",7/31/2003,
1,2003-07-06T05:00:00+0000,"SARS Declared Contained, With No Cases In Past 20 Days",World,"World Heath Organization declares SARS has been contained around world, with no new cases reported to agency by any nation since June 15; warns disease could still pose threat; removes Taiwan from its list of SARS-affected areas; SARS has infected 8,439 people in 30 nations and killed 812 people (M)",7/6/2003,
2,2003-07-03T05:00:00+0000,World Briefing | Americas: Canada: SARS All-Clear,World,"World Health Organization removes Toronto from its list of SARS infected regions, leaving only Taiwan on list; Toronto, originally taken off list in May, was put back on after new cluster of victims surfaced; 38 people have died in Toronto area and 11 individuals remain in critical or deteriorating condition (S)",7/3/2003,
3,2003-06-26T05:00:00+0000,World Briefing | Asia: China: New Sars Case,World,China reports new case of SARS in Guangdong Province one day after World Health Organization lifts ban on travel to Beijing and declares country to have effectively controlled disease; patient was already under quarantine as suspected SARS case (S),6/26/2003,
4,2003-06-25T05:00:00+0000,"China Has Quelled SARS, World Health Agency Says",World,"World Health Organization declares that Beijing has effectively conquered SARS, prompting relief and celebration around city, where just a few weeks ago people stopped going to work, eating at restaurants or even leaving their homes for fear of catching disease; government officials hail suppression of SARS as victory for Communist Party leadership, seeking to gain public credibility even though official dissembling and inefficiency contributed to its rapid spread last winter (M)",6/25/2003,
5,2003-06-21T05:00:00+0000,"Isolation, an Old Medical Tool, Has SARS Fading",World,"Mystery virus SARS, which three months ago seemed poised to become worldwide epidemic, reportedly is disappearing almost as quickly and as unpredictably as it arrived; World Health Organization declares virus under control, with only handful of cases worldwide; health officials and infectious disease experts are racing to learn what they can from sudden rise and retreat of SARS, what caused its spread and strategies that succeeded in containing it; communicable diseases expert Dr Mike Ryan cites better infection controls in hospitals and early quarantining of infected individuals; graph; map; photo (M)",6/21/2003,
6,2003-06-18T05:00:00+0000,"As SARS Ebbs, W.H.O. Lifts Its Advisory On Taiwan",World,"WHO lifts advisory against travel to Taiwan, leaving Beijing as only place travelers are urged to avoid because of SARS risk; Taiwan has had five or fewer new cases every day this month (S)",6/18/2003,1
7,2003-06-17T05:00:00+0000,SARS Advisory Against Traveling to Taiwan Is Lifted,World,Beijing is now the only place that the World Health Organization is telling travelers to avoid because of the risk of SARS.,6/17/2003,
8,2003-07-01T05:00:00+0000,Analysts See Tension in China Within the Top Leadership,World,"China analysts say conflict between supporters of Pres Hu Jintao and predecessor Jiang Zemin exposes tensions within top leadership and makes it more difficult for new generation to put its stamp on politics; Jiang, 76, retains enormous political muscle by keeping allies in key posts and staying on as chairman of Central Military Commission; Hu, 60, solidifies his stature with strong handling of SARS epidemic, but has to navigate between liberal intellectuals calling bluntly for political change and Jiang allies, who fear instability and reportedly try to reverse trend toward government openness (M)",7/1/2003,
9,2003-06-14T05:00:00+0000,W.H.O. Lifts SARS Alert in China Regions,World,"World Health Organization removes travel advisory for four Chinese provinces, sign that SARS virus is slowly being contained; only Beijing and Taiwan still have warnings against all but essential travel (M)",6/14/2003,1
0,2003-06-11T05:00:00+0000,A Visitor to Toronto Is Stricken With SARS,World,"North Carolina man who visited Toronto in May comes down with SARS, apparently contracted while visiting relative at nursing home; health officials in state say case is mild and illness has not spread (S)",6/11/2003,
1,2003-06-11T05:00:00+0000,Singapore Tightens SARS-Control System,World,Singapore toughens its already strict SARS-prevention regimen (S),6/11/2003,
2,2003-06-26T05:00:00+0000,World Briefing: Asia,World,SOUTH KOREA: Summit Meeting Charges; CHINA: New Sars Case;.,6/26/2003,
3,2003-06-08T05:00:00+0000,The SARS Enigma,World,"Lawrence K Altman news analysis on many imponderables about SARS epidemic, particularly reliability of data from China, where disease has struck hardest; major concern is volatility of disease that has spread to more than 30 countries, but with unequal force, and has been devastating in Toronto; Dr David L Heymann of WHO explains that missing single case can fire up new outbreak, as in Singapore (M)",6/8/2003,
4,2003-06-10T05:00:00+0000,Singapore Enacts Penalties for Lying About SARS Exposure,World,Singapore is adding to the strict public health measures it has used to bring the outbreak under control.,6/10/2003,
5,2003-06-10T05:00:00+0000,15 New Cases Of Pneumonia Near Toronto May Be SARS,World,"Ontario health officials say they are concerned over new cluster of suspected SARS cases in hospital in Whitby, hour's drive east of Toronto, where 15 people receiving dialysis have contracted pneumonia; say there is no obvious connection to any previous patient with SARS, but they are assuming it is SARS and taking appropriate precautions; authorities are scrambling to find epidemiological link to possible new cluster, to contain broader possible outbreak (M)",6/10/2003,
6,2003-06-08T05:00:00+0000,"More Cases of SARS, but No New Deaths",World,"No new SARS deaths were reported on Saturday, but China, Hong Kong and Taiwan all announced new cases.",6/8/2003,
7,2003-06-21T05:00:00+0000,World Briefing | Asia: China: Disease Outbreak Confirmed,World,"Japanese encephalitis outbreak in Guangdong Province (China) is confirmed as regional authorities announce 18 deaths and 211 cases of disease; secrecy about outbreak, reminiscent of regional confusion regarding SARS outbreak, has caused Hong Kong officials to be concerned (S)",6/21/2003,
8,2003-06-20T05:00:00+0000,Pattaya Journal; A Famed Resort Where Tourists Fear to Tread,World,"Pattaya, Thailand's most famous beach resort, is virtually empty of tourists amid fears of terrorism and SARS infection; situation has only worsened with recent arrest of three men in Muslim south who said they were members of terrorist cell that was planning to attack embassies and entertainment spots; residents report growing prejudice against Arabs; map; photos (Pattaya Journal) (M)",6/20/2003,
9,2003-06-06T05:00:00+0000,"SARS Outbreak Fading Away, Officials Say",World,"Dr Henk Bekedam of World Health Orgn says SARS epidemic is winding down all over world, including China, worst-hit country; this is second day in row that China has no new cases of disease; Bekedam says WHO now believes that statistics released by Chinese government are generally reliable; despite pronounced decline in new cases, international health officials warn that continued vigilance is necessary to prevent resurgence like one occurring in Toronto this week (M)",6/6/2003,
0,2003-06-04T05:00:00+0000,"Now, the SARS Emotional Toll",World,"Pace of new SARS infections ebbs in East Asia, but disease takes emotional toll, both on people infected and on many more who face discrimination because of their association with victims; photos; Hong Kong study finds psychiatric problems among survivors; complaints of job discrimination also reported (M)",6/4/2003,
1,2003-06-05T05:00:00+0000,"SARS Epidemic Winding Down, Health Officials Say",World,"The SARS epidemic seems to be on the decline all over the world, including in China, the worst hit country, health officials said today.",6/5/2003,
2,2003-05-31T05:00:00+0000,"SARS Ebbs in East Asia, but Financial Recovery Is Slow",World,"Economists and business executives say economic consequences of SARS in East Asia will continue to be felt for months, even as number of new cases declines; strong divergence between slow domestic demand and brisk exports had made it particularly difficult for economists to gauge economic output; outlook for China and Hong Kong discussed; photo (M)",5/31/2003,
3,2003-05-30T05:00:00+0000,Number of SARS Cases Falls Sharply in China,World,"China has nearly tamed the SARS epidemic, with new cases dwindling and no evidence of the wildfire spread in the hinterlands that experts had feared.",5/30/2003,
4,2003-05-30T05:00:00+0000,Number of SARS Cases Falls Sharply in China,World,"China has nearly tamed the SARS epidemic, with new cases dwindling and no evidence of the wildfire spread in the hinterlands that experts had feared.",5/30/2003,
5,2003-05-31T05:00:00+0000,China Says SARS in Retreat; Canada Has Another Death,World,"China reports number of new SARS cases is dwindling and there is no evidence that infection is spreading to hinterlands, as some experts had feared; reports seven new cases; about 5,600 cases have been reported nationwide since first outbreak; Canadian health officials announce death in Toronto of another SARS patient, 30th to die of disease there so far; international experts raise questions about China's reporting but generally agree disease appears to be waning there (M)",5/31/2003,
6,2003-05-30T05:00:00+0000,Fallout From Hong Kong SARS Will Hit Far and Wide,World,"While SARS infections have ebbed across east Asia, the economic consequences may continue to be felt for months to come.",5/30/2003,
7,2003-05-29T05:00:00+0000,Quarantine Hits Toronto School In SARS Fight,World,"Health authorities in Canada quarantine as many as 2,000 students, teachers and staff members of large parochial school on outskirts of Toronto that was closed after 11th-grade student attended classes for two days last week while showing symptoms of SARS; new quarantine underscores potential seriousness of new outbreak of SARS, only two weeks after local and international authorities declared it was no longer spreading in Toronto; second potential new case of SARS is being investigated in small Ontario community of Parry Sound after resident there develops SARS-type symptoms following visit to affected hospital in Tornoto; 70 residents of Parry Sound are in quarantine; possibility that disease has affected fifth hospital in metropolitan Toronto area is also under investigation after new wave of illness is reported; two elderly SARS patients die, bringing total to 29 deaths in Toronto area in three months; photo (M)",5/29/2003,
8,2003-05-30T05:00:00+0000,Toronto Triples Its SARS Tally to 33 Probable Victims,World,"Health authorities say number of people they consider infected by second outbreak of SARS in Toronto has tripled in last 24 hours, although some officials express optimism that new cluster of cases has reached its peak; increase in cases was expected and comes as result of new patients showing symptoms after incubation period that followed recent exposure; it is also because of redefinition by local officials of what constitutes proven case of SARS; World Health Orgn officials say they are not contemplating new travel advisory at this point; photo (M)",5/30/2003,
9,2003-05-29T05:00:00+0000,Hong Kong Names a Panel to Plan for SARS,World,"Hong Kong's leader Tung Chee-hwa names panel of international experts to draft contingency plans for another SARS outbreak next winter; says no specific official will be investigated in government's handling of disease there this spring; says panel's chairman will be Dr Yeoh Eng-kiong, secretary of health, welfare and food, who is controversial figure because he consistently sought to play down seriousness of outbreak when it began in mid-Mar; unlike governments of Singapore and Vietnam, which quarantined initial victims of SARS, Hong Kong left hospital ward housing SARS patients open to visitors, some of whom contracted disease and then spread it in community; decision to focus panel on how to respond to future outbreaks, and to name Dr Yeoh as its chairman, draws strong criticism from Hong Kong's opposition parties; photo (M)",5/29/2003,
0,2003-05-27T05:00:00+0000,Reported Asian SARS Cases Continue to Fall,World,Fewer than two dozen new cases of SARS were reported in Asia today as the disease appeared to recede further in the region.,5/27/2003,
1,2003-05-28T05:00:00+0000,SARS Forces Beijing to Fight An Old but Unsanitary Habit,World,"China's battle against SARS virus takes on old unsanitary habit of spitting in street, with authorities and volunteers handing out little plastic spit bags in parks and malls; photos; Communist Party Central Committee gives imprimatur to campaign, issuing Directive on Launching Activities to Transform Vile Habits (M)",5/28/2003,
2,2003-05-27T05:00:00+0000,Toronto Again Listed as City With Spreading SARS Cases,World,"World Health Orgn restores Toronto to its list of places where SARS is spreading after Ontario health authorities announce eight new probable cases of disease; United States Centers for Disease Control and Prevention issues new travel alert for Toronto; total of 27 pepole in Toronto have died of SARS, including 2 of 8 new cases (M)",5/27/2003,
3,2003-05-27T05:00:00+0000,Tests in China Suggest Some With SARS Don't Become Ill,World,"World Health Orgn reports that blood tests of people who work with exotic animals in markets in southern China show that significant proportion apparently have been infected with SARS virus, suggesting that some people may become infected without becoming ill; findings are from two separate studies of workers in markets in Guangdong Province; they strengthen SARS link between animals and humans (M)",5/27/2003,
4,2003-05-27T05:00:00+0000,SARS Scare Casts Pall on Las Vegas of Siberia,World,"Blagoveshchensk, small city in remote southern Siberia, has carved itself prosperous niche as mecca for Chinese gamblers; 7 of every 10 customers at its casinos come from China, where gambling is illegal; flow of Chinese gamblers stops after local man is diagnosed as Russia's only known case of SARS, and local border posts snap shut; Russian authorities are focusing on Chinese presence in border area of Siberia as potential entry route for virus; photo; map (M)",5/27/2003,
5,2003-05-24T05:00:00+0000,Singapore Begins SARS TV Channel,World,Singapore's three main broadcasters begin special public service channel carrying only news and information about severe acute respiratory syndrome; channel is meant to raise awareness about symptoms and prevent spread of SARS (S),5/24/2003,
6,2003-05-24T05:00:00+0000,Strain of SARS Is Found In 3 Animal Species in Asia,World,"World Health Organization reports virus virtually identical to one thought to cause SARS in humans has been found in masked palm civets and two other exotic animal species sold in Guandong Province, where early cases of SARS occurred among food handlers who sold live exotic animals for human consumption; evidence raises possibility that virus jumped from animals to humans; Chinese government plans to ban sale of animals; Chinese scientist doubts ban will succeed because civet is traditional delicacy; photo (M)",5/24/2003,
7,2003-05-21T05:00:00+0000,SARS Fears Shake Taiwan Medical Staffs,World,"Doctors and nurses are resigning en masse in Taiwan for fear of SARS; 94 percent of Taiwan's known cases were transmitted inside hospitals, with new outbreak just reported; photo; nine major hospitals have been fully or partially shut down (M)",5/21/2003,
8,2003-05-21T05:00:00+0000,W.H.O. Expresses Optimism China Can Control SARS,World,"WHO reports number of SARS cases being reported in China is dropping rapidly in many areas of country, bringing wary optimism about containing disease; Dr Henk Bekedam says he does not now believe disease will become endemic in China (M)",5/21/2003,1
9,2003-05-23T05:00:00+0000,Market for Chinese-American Delicacy Plummets,World,"Sale of squab, delicacy favored by Chinese-Americans, has dropped because of SARS epidemic; squab farmers in Modesto, Calif, are packing birds away in cold storage because fear of SARS has emptied most restaurants in San Francisco's Chinatown; photo (M)",5/23/2003,
0,2003-05-19T05:00:00+0000,"As SARS Eases, Beijing Classes Resume",World,"Beijing students will start returning to school over next several weeks, as threat of SARS apparently eases in China; China has reported 5,223 cases with 284 fatalities (S)",5/19/2003,
1,2003-05-22T05:00:00+0000,U.N. Health Agency's New Head Pledges Stronger Response to Epidemics Like SARS,World,"Dr Jong-Wook Lee, newly elected director general of World Health Orgn, pledges to expand and strengthen agency's response network to help alert world to epidemics like SARS; says he would seek $200 million from donor countries to train more epidemiologists and develop field laboratories in poor countries, as well as to evaluate global response to new diseases like SARS; he recently visited China, which has reported overwhelming majority of 7,956 SARS cases reported in world; Chinese news agency reports arrest of man accused of deliberately spreading SARS virus; man reportedly escaped from hospital twice while being treated for disease; WHO expands its travel advisory to include all of Taiwan, not just its capital, Taipei, after Taiwan's Center for Disease Control announces 65 more probable cases on island (M)",5/22/2003,
2,2003-05-17T05:00:00+0000,Ireland Bars Athletes From Nations With SARS,World,"Irish government asks athletes from countries affected by SARS not to travel to Ireland for Special Olympics World Summer Games, but also says it will reconsider its decision as more information becomes available; decision would take effect 10 days before 6,500 participating athletes would normally arrive for competition; affected areas would be determined by list that World Health Organization issues each day (M)",5/17/2003,
3,2003-05-17T05:00:00+0000,Latest SARS Victim Is Clothing Industry,World,"SARS hits apparel business hard; more than $23 billion of clothing--40 percent of all American clothing imports--is shipped to United States every year from Far East, region most severely affected by SARS; within last two months, America's clothing industry has been disrupted by SARS-related bans on travel, delayed shipments of merchandise and worries about what future could bring; photo (M)",5/17/2003,
4,2003-05-23T05:00:00+0000,U.S. Doctor With Symptoms To Fly Home From Taiwan,World,"American doctor advising Taiwan on fighting its SARS epidemic is being flown home by air ambulance after coming down with symptoms of the disease; three healthy colleagues will accompany him; if he does have SARS, he will be first American investigator to have caught disease; he is Dr Chesley L Richards Jr, epidemiologist for US Centers for Disease Control and Prevention; hotel where he stayed in Taipei voluntarily closes for three days of disinfection, and 13 employees are placed in home quarantine; 200 other employees and guests are told to take their temperatures regularly; Dr Julie L Gerberding, directer of CDC, says possibility that expert in hospital infection control might have been infected in hospital underlines difficulty of protecting against SARS virus (M)",5/23/2003,
5,2003-05-19T05:00:00+0000,SARS Furor Heightens Taiwan-China Rift,World,"Taiwan's hopes of being granted observer status in World Health Orgn have been blocked for years by China; because China has become target of international criticism for hiding its SARS epidemic so long that it burst out across Asia, there may be more of fight this year; Taiwan now has SARS-based argument--that excluding it imperils world; Taiwan has voluntarily reported its communicable disease figures to WHO, and sneers at China's early cover-up (M)",5/19/2003,
6,2003-05-20T05:00:00+0000,"No Cases of SARS Have Been Transmitted on Airlines Since March, W.H.O. Reports",World,"World Health Orgn reports no cases of SARS have been transmitted on airline flights since late Mar, after it recommended that countries and airlines screen passengers and crew members departing from affected areas; says most recent affected flight was on Mar 23, from Bangkok to Beijing, four days before it made its recommendations on air travel; Taiwan, which is battling epidemic of SARS, is unsuccessful in its effort to use disease as reason to gain observer status in WHO; photo (M)",5/20/2003,1
7,2003-05-17T05:00:00+0000,"For Some Adoptive Parents, SARS Brings a Heart-Rending Delay",World,"Chinese government, reacting to SARS epidemic, halts two final steps in long process by which foreigners adopt Chinese babies, making travel to China nearly impossible for some adoptive parents; virus outbreak may delay adoption of 100 children a week, causing heartache to adoptive parents; photos (M)",5/17/2003,
8,2003-05-23T05:00:00+0000,Some Chinese Say Government's Response to Epidemic Has Been Too Heavy-Handed,World,"China's Communist Party seeks to claim credit for defusing SARS crisis caused partly by official denial and deceit; some scholars and media commentators, disagree, saying SARS did more to expose weaknesses of China's political culture than its strengths; frank debate about government's handling of SARS comes as anxiety about disease has begun to ease (M)",5/23/2003,
9,2003-05-28T05:00:00+0000,W.H.O. Expected to Gain Broader Powers,World,"World Health Organization's 192 member nations are expected to grant it sweeping new powers to respond to international health threats such as SARS and bioterrorist attacks; new powers including setting up communications network, tapping reliable unofficial sources of information and sending own teams to see how countries are responding to outbreaks (S)",5/28/2003,1
0,2003-05-16T05:00:00+0000,Taiwan Health Minister Quits Over His Handling of SARS,World,"Saying he was ashamed at how quickly the SARS epidemic has grown here, Taiwan's health minister resigned today.",5/16/2003,
1,2003-05-15T05:00:00+0000,China Threatens Execution in Intentional Spreading of SARS,World,"Applying the death penalty to an irresponsible SARS patient may be unlikely, but the government, after concealing the scope of the disease, now seems determined to do all it can to stop it.",5/15/2003,
2,2003-05-25T05:00:00+0000,Relieved Hong Kong Starts to Shed Masks,World,World Health Organization's advisory against travel to Hong Kong is now lifted but economic growth may not fully rebound quickly; most of people out celebrating have shed masks that were symbol of Hong Kong over past two months; photo (M),5/25/2003,
3,2003-05-18T05:00:00+0000,W.H.O. Scientists Say Tactics To Fight Virus Are Working,World,"Scientists brought together by World Health Organization to review data on SARS say existing public health measures have been effective in containing it in many countries and should work in China and Taiwan, where virus is concentrated; detection and treatment of suspected cases as soon as they are identified and then quarantining contacts is essential; message from meeting is hopeful; there is no evidence that animals or insects are spreading disease; information at meeting about super-spreaders discussed; photo (M)",5/18/2003,1
4,2003-05-25T05:00:00+0000,Ill Doctor Is Back in U.S.,World,"Dr Chesley L Richards Jr, American doctor suspected of having SARS, and three colleagues who advised Taiwan, arrive in Atlanta from Taipei; Richards is epidemiologist for Centers for Disease Control and Prevention (S)",5/25/2003,
5,2003-05-14T05:00:00+0000,"Experimental Drug May Fight SARS, Researchers Say",World,"German researchers say that experimental Pfizer drug AG-7088, which was tested and shelved as common cold remedy, may, with some chemical tinkering, be used to fight SARS virus; Pfizer did not apply for FDA approval and modification would take several years; researcher Dr David Ho says in Hong Kong that he and colleages at Aaron Diamond AIDS Research Center in New York have synthesized several peptides that could prevent SARS from entering human cells, but that will also take years of testing (M)",5/14/2003,
6,2003-05-14T05:00:00+0000,Suspected SARS Outbreak in a Hospital Deals a Setback to Taiwan,World,"Possible new SARS outbreak at Chang Gang Hospital, modern center in Kaohsiung, deals setback to Taiwan's efforts to fight epidemic; Taiwan now has 288 probable cases and 25 deaths; photo; map; graph (M)",5/14/2003,
7,2003-05-15T05:00:00+0000,"Taiwan SARS Cases Jump, but Officials Think Tally Is Low",World,"Even as Taiwan was reporting its biggest one-day jump in probable SARS cases, health officials said today that the outbreak in the country is probably much bigger than reported.",5/15/2003,
8,2003-05-24T05:00:00+0000,"New Travel Alert Is Issued for Toronto, But a Glimmer of Success for Hong Kong",World,"World Health Organization lifts its advisory against travel to Hong Kong and neighboring Guangdong Province, China, once twin centers of SARS outbreak; Centers for Disease Control and Prevention reinstates travel alert for Toronto after Canadian authorities report cluster of new possible SARS cases; new cases involve health care workers, hospital patients and some family members; health officials order quarantine for hundreds of people who may have spent time at hospital this month before some of new suspected cases were discovered; Hong Kong has brought down daily rate of new infections from as many as 80 to fewer than 5 for last eight days; photos (M)",5/24/2003,
9,2003-05-16T05:00:00+0000,New Advice on Travelers Stresses a Rational Caution,World,"World Health Orgn issues guidelines on how to handle travelers arriving from areas with cases of SARS; stresses that only people who have symptoms are contagious and can transmit the disease, and that close contact is required for transmission; says traveler with no symptoms who has not been in close contact with suspected SARS case should not face any restrictions; advises people who have had close contact with suspected case over preceding 10 days to stay home and contact health department; says healthy pepole who have had contact with SARS case should defer blood donations for three weeks after last contact, and those who have had probable case of SARS should not donate for three months after recovering fully (M)",5/16/2003,
0,2003-05-16T05:00:00+0000,"Single Case, Unproven, Stirs Fear Of Chinese",World,"Russia's far east, on Siberian border with China, takes action to combat SARS epidemic that may or may not be serious; its economy, which increasingly has come to rely on Chinese trade and labor, is starting to grind slower; area's substantial Asian population is living under long shadow of rumor and suspicion; in Blagoveshchenks, young Russian municipal worker has been lying in medical isolation for last two weeks, with doctors suspecting he has SARS but unable to verify their diagnosis so far despite many tests; photo (M)",5/16/2003,
1,2003-05-15T05:00:00+0000,Thousands Are Quarantined at Taiwan's Top Hospital,World,"National Taiwan University Hospital, Taiwan's leading hospital, is so overwhelmed by internal outbreak of SARS that it is effectively shut down, dealing serious blow to crown jewel in island's medical system; more than 250 staff members are placed in quarantine, including at least 40 doctors and 68 nurses, as well as all patients; Taiwan has rapidly surpassed Canada and Singapore to have world's third-worst outbreak, after mainland China and Hong Kong; military trucks that spray bleach solutions roam streets; photos (M)",5/15/2003,
2,2003-05-16T05:00:00+0000,Number of Cases in Taiwan May Be More Than Reported,World,"World Health Orgn officials say outbreak of SARS in Taiwan is being inaccurately counted and is probably much bigger than reported; official Taiwan tally is 264 cases with 34 deaths; Dr Lee Ming-liang, former health minister leading fight against epidemic, says Taiwan would conform to WHO standards in reporting outbreak, and that when it does, there may be many more probable cases; disease has spread to another major hospital in Taipei, infecting 7 doctors and nurses said to be wearing full infection gear, and ambulance drivers, one of whom dies (M)",5/16/2003,
3,2003-05-16T05:00:00+0000,China Suspends Adoptions and Sets Edict to Fight Virus,World,"China, major destination for Western parents who want to adopt child, temporarily suspends most foreign adoptions of Chinese babies in effort to combat SARS epidemic; announces severe new penalties, including execution, for anyone knowingly spreading the disease; says adoptive parents already in China, and in some cases those who have made final travel arrangements, will be allowed to proceed; government official says few cases of SARS have appeared in China's rural towns and villages, but that danger is great; many citizens of Beijing privately express disillusionment or anger over government's initial impulse to play down severity and extent of disease, which hindered control efforts; photo (M)",5/16/2003,
4,2003-05-12T05:00:00+0000,Taiwan SARS Cases Reach a One-Day High,World,"The number of new SARS cases surged to a single-day record in Taiwan today, while outbreaks elsewhere in Asia showed continuing signs of receding.",5/12/2003,
5,2003-05-15T05:00:00+0000,"Man's Virus Infects Town, Killing His Family",World,"Case of Dr Li Song of Linhe, China, reflects medical, political and economic repercussions of SARS; Li returned to Linhe, in Inner Mongolia, from trip to Beijing in late Mar, unknowingly carrying strain of SARS powerful enough to infect six immediate family members, at least nine medical workers and county official; all told, Linhe area now has more than 100 cases of SARS, many of them traced to Li; his family members died but he survived, and now city authorities are holding him accountable for malfeasance that they claim worsened SARS epidemic; they point to fact that week after Li was admitted to hospital he walked out; he told friends he was frustrated with care he was being given and alarmed at news that both his parents were also ill; Li's friends and colleagues say he broke no laws and cannot be blamed; strongly worded article on Communist Party newspaper suggests search for scapegoat; photo; map (L)",5/15/2003,
6,2003-05-15T05:00:00+0000,Toronto Is Stricken From Warning List Issued by W.H.O.,World,World Health Orgn removes Toronto from its list of cities and provinces where SARS is spreading and putting general population at risk; decision comes three weeks after WHO issued travel advisory about Toronto; advisory was reversed six days later (M),5/15/2003,1
7,2003-05-09T05:00:00+0000,Russia Urges Travel Limit On Suspicion Of SARS Case,World,"Russia urges its airlines to halt flights to and from China, Hong Kong and Taiwan and crimp entries along 2,624-mile Chinese border after nation tentatively logs its first known case of disease; health officials in Blagoveshchensk, on Russia's far eastern border with China, say seriously ill man is improving after having been quarantined on May 1 with flulike symptoms; federal and local officials issue conflicting orders, making it difficult to determine how vigorously Russia is moving to curtail spread of illness, or even whether coordinated effort exists (M)",5/9/2003,
8,2003-05-22T05:00:00+0000,"Masks Become a Taiwan Must-Have, With Bootlegging and Price Gouging",World,"Taiwan, hit hard by SARS epidemic, is mask mad; importers are ordering truckloads of them, and Chinese-Americans are shipping them to relatives on island; public health experts say roaring underground market for N95 masks, which filter out 95 percent of particles, is based largely on misunderstanding; say average person could wear simple paper surgical mask as Pres Chen Shui-bian did when he appeared in public this week; photo (M)",5/22/2003,
9,2003-05-11T05:00:00+0000,Berkeley Campus Eases SARS Curbs on Some Asian Students,World,"Officials at University of California, Berkeley, relax SARS-related restrictions on summer enrollment of some students from Chinese mainland, Hong Kong and Taiwan (M)",5/11/2003,
0,2003-05-10T05:00:00+0000,U.S. Warns Promoters of SARS-Related Products,World,FTC and FDA warn more than 40 Web site operators to stop making false claims about products that supposedly prevent or treat SARS (S),5/10/2003,
1,2003-05-08T05:00:00+0000,Most Taiwan SARS Cases Spread by One Misdiagnosis,World,"Director general of Taiwan's Center for Disease Control says most of Taiwan's SARS cases can be traced to one man whose lung ailment was misdiagnosed for five days; says that patient caused rapid growth in cases that began on Apr 21 and forced closing of four hospitals; says hospital will be fined for misdiagnosing patient's disease and failing to report its error for two days longer; says health authorities think they have traced sources of infection for all but 6 of island's 116 probable cases; in Hong Kong, 11 more people are reported to have died of SARS, bringing death toll to 204; on mainland China, there are 159 new cases, for total of 4,560; 219 people have died; photos (M)",5/8/2003,
2,2003-05-10T05:00:00+0000,Herbs? Bull Thymus? Beijing Leaps at Anti-SARS Potions,World,"SARS spawns booming market in Beijing for potions, disinfectants, gloves, masks and herbal concoctions of dubious utility for warding off infection; millions of Chinese rush to buy new products touted every few days by newspapers, experts or officials; photo; prevention strategies range from vitamin C to injections of bull thymus (M)",5/10/2003,
3,2003-05-08T05:00:00+0000,"At Hong Kong Hospitals, SARS Takes a Heavy Toll on Nurses",World,"SARS remains extremely dangerous for nurses, hundreds of whom have been infected in Canada and Asia despite many precautions; in Hong Kong, two or three more health care workers, usually nurses, are still being infected every day; nurses now make up 55 percent of 368 health care workers in Hong Kong who have confirmed cases of SARS; doctors account for 15 percent of cases; remaining 30 percent of cases are among ward attendants, nursing assistants, cleaners and other hospital workers; photo; chart (M)",5/8/2003,
4,2003-05-20T05:00:00+0000,The Sheltered Children of Beijing,World,"Most notable change in street life in Beijing since onset of SARS epidemic is absence of children; with schools closed for nearly month, majority of Beijing's precious only children are virtual prisoners at home, kept in iron-clad parental lock down to protect them from SARS; photo (M)",5/20/2003,
5,2003-05-07T05:00:00+0000,U.S. Approves Force in Detaining Possible SARS Carriers,World,"Administration officials say Pres Bush has authorized immigration and customs agents at airports to use force to detain arriving passengers who appear to have SARS symptoms as part of efforts to prevent United States epidemic; Homeland Security Department has provided masks and gloves to thousands of its airport inspectors in last month; has trained inspectors to give extra attention to health of passengers arriving on 51 daily flights from Asian cities where SARS outbreak has been severe; no passenger has yet required forcible detention, suggesting Asian governments and airlines have successfully barred infected passengers from boarding flights; photo (M)",5/7/2003,
6,2003-05-08T05:00:00+0000,W.H.O. Doubles Its Estimate Of Death Rate From SARS,World,"World Health Orgn doubles its previous estimate of overall death rate from SARS, to about 15 percent, after analyzing more complete data; revised death rate indicates SARS is proving much more serious than first thought; WHO says latest detailed data from Canada, China, Hong Kong, Singapore and Vietnam shows death rates vary by age: more than 50 percent in people 65 and older; 15 percent in those 45 to 64; 6 percent among those 25 to 44; and 1 percent for those 24 and younger; epidemic is thought likely to change as more information comes in; statistic that has been hard to calculate for SARS is incubation period--interval from time of exposure to onset of symptoms--because individuals may have been exposed to virus on number of occasions (M)",5/8/2003,1
7,2003-05-10T05:00:00+0000,Taipei Seals Housing Project As Taiwan Tries to Halt SARS,World,"Taiwan authorities quarantine two buildings in public housing project because of three suspected SARS cases inside; photo; schools and public venues may be closed; Taiwan has 149 probable cases, only six of unknown origin (S)d",5/10/2003,
8,2003-05-07T05:00:00+0000,Study Suggests A Higher Rate Of SARS Death,World,"Statistical analysis of 1,425 patients suspected of having SARS who were admitted to Hong Kong hospitals from Feb 20 to Apr 15 suggests death rate from SARS could be up to 55 percent in people 60 and older and 13.2 percent in younger people, for overall rate of 19.9 percent, far higher than health officials had thought; unless numbers fall drastically, SARS would be among infectious diseases with highest death rates; difficulty of calculating mortality rates for newly emerging diseases noted; photo (M)",5/7/2003,
9,2003-05-07T05:00:00+0000,How Vietnam Halted SARS And Saved the Life of a Nurse,World,"Vietnam's success in stopping spread of SARS described; Aileen Plant, who led fight against SARS in Vietnam for World Health Organization, cites government's decision after key Mar 9 meeting with WHO to fight outbreak openly and aggressively; says most of government was mobilized to deal with infection and its consequences; disease entered nation through one infected person, American Johnny Chen, who came to Hanoi in Feb after Hong Kong stay; Vietnam moved quickly to confine outbreak to Hanoi French Hospital, where he was treated before being evacuated to Hong Kong, where he died; Vietnam closed hospital to new patients and visitors Mar 11; most of its staff remained inside, some falling ill, others watching colleagues sicken and die; Nguyen Thi Men, nurse who was only survivor of six most critically ill patients, describes recovery, interview; photo (M)",5/7/2003,
0,2003-05-06T05:00:00+0000,Students in SARS Countries Banned for Berkeley Session,World,"Univ of California at Berkeley takes unusual step of turning away about 500 summer students from China, Taiwan, Hong Kong and Singapore because of large number of SARS cases reported in those areas; university officials say decision is based on advice from city's health officer and campus health experts; students enrolled at other campuses in Univ of California system will not be affected, although system issues statement urging campus officials to consider following Berkeley's lead; there have been no reported cases of SARS at Berkeley; other American universities have not taken major step Berkeley has, but they are being vigilant about visitors from SARS-affected areas; some colleges are pulling back students from study-abroad programs in those areas and have canceled summer programs (M)",5/6/2003,
1,2003-05-06T05:00:00+0000,Hong Kong to Set Up a Center To Conduct SARS Research,World,"Hong Kong will establish regional medical surveillance and research center to study SARS and spot future illnesses before they can turn into epidemics, and will ask neighboring Guangdong Province to cooperate; Tung Chee-hwa, Hong Kong's chief executive, will ask Legislative Council for $64 million for research into infectious diseases; has been in detailed talks about SARS with Pres Hu Jintao and Prime Min Wen Jiabao of China and with Guangdong provincial leaders; World Health Orgn welcomes research initiative because Pearl River delta, which encompasses Hong Kong, Macao and much of Guangdong, has history of producing many of world's biggest pandemics; SARS is thought to have started in Guangdong; photo (M)",5/6/2003,
2,2003-05-06T05:00:00+0000,Sales of U.S. Company's Drug Rise as Chinese Try It Against SARS,World,"Sales of antiviral drug Zadaxin surge because doctors in China are using it in attempt to contain widening outbreak of SARS; drug is produced by small American biotechnology company SciClone Pharmaceuticals; it is not yet approved for use in United States, Europe or Japan; SciClone president Donald R Sellers says Chinese are probably trying many drugs; Zadaxin is currently being tested by US government scientists, who are screening thousands of compounds in hopes of finding some that may work against SARS (M)",5/6/2003,
3,2003-05-03T05:00:00+0000,SARS Spreads in Taiwan; W.H.O. Plans Trip There,World,"SARS appears to be spreading in Taiwan as fast or faster than anywhere except mainland China, prompting World Health Organization to prepare to send team there despite risk of creating diplomatic tensions with Beijing; Taiwan announces that it has 11 more confirmed cases, number that has more than tripled in last 10 days; five people die of SARS in Taiwan, raising its death toll to eight; chart shows outbreak in Taiwan; photo (M)",5/3/2003,1
4,2003-05-09T05:00:00+0000,"Travel Warning Unfair, Taipei's Mayor Says",World,"Mayor Ma Ying-jeou of Taipei says it is unfair of World Health Orgn to advise against travel to city; says many precautions have been taken to make city safe; notes Taiwan has already imposed strict travel restrictions of its own: no one except Taiwanese citizens may enter from mainland China, Hong Kong, Singapore or Toronto (M)",5/9/2003,
5,2003-05-03T05:00:00+0000,Executives in Singapore Chafe at SARS-Related Travel Bans,World,"Malaise spreads throughout executive class in Singapore, even as signs emerge that Singapore has largely contained its own outbreak of SARS; many executives chafe at travel restrictions imposed by their companies, which are keeping them stuck in Singapore unable to visit clients (M)",5/3/2003,
6,2003-05-06T05:00:00+0000,World Briefing | Asia: China: More Unrest Over Sars,World,"Estimated 1,000 villagers in Zhejiang, China, surround government office and vandalize officials' cars in protest against quarantining of SARS patients in building; residents fear spread of SARS to their neighborhood (S)",5/6/2003,
7,2003-05-09T05:00:00+0000,"Quarantine Ends for Some in Beijing, but the Infection Is Still Spreading",World,"About 400 students, teachers and workers emerge from two weeks' quarantine at university in Beijing, but there are 94 more confirmed cases of SARS in capital; one Communist Party leader says more than 120 officials around country have been fired or disciplined for 'lack of vigor' in containing virus or for concealing local cases; greatest fear of Chinese and international health officials now is that SARS may start spreading fast in China's vast, medically underequipped interior provinces; photo (M)",5/9/2003,
8,2003-05-03T05:00:00+0000,"For Anxious Families, SARS in China Adds Uncertainty",World,"SARS epidemic in China does not deter Americans from traveling there to adopt babies; their trips are delayed, however, by complications like closed offices and crippled transportation systems; photos (M)",5/3/2003,
9,2003-05-09T05:00:00+0000,"Study Says Virus Has Remained Stable, Not Weakening as the Illness Spread",World,"First major study of genome of SARS virus shows it has not mutated significantly in its spread to different countries; some experts are encouraged, saying that if virus remains stable, chances increase that vaccine might be developed; other experts had expressed hope that SARS virus would weaken as it passed through successive generations, causing less severe illness as it spreads; World Health Orgn extends its warning against nonessential travel to Tianjin municipality and Inner Mongolia in China and to Taipei, Taiwan, citing continuing spread of disease; graphs (M)",5/9/2003,
0,2003-05-01T05:00:00+0000,12 SARS PATIENTS REPORT RELAPSES,World,"Hong Kong health officials say dozen patients who seemed to recover from SARS have become ill again after leaving hospital; relapses raise unsettling questions on disease, about which much is still unknown; officials say some became ill again more than two weeks after discharge; it is not clear whether patients contracted infection second time, or simply became ill with same virus after seeming to recover; relapses may mean that patients can still transmit SARS even when they are no longer thought to be infectious; if so, transmission might recur in countries where officials have said outbreak is over; these are first relapses to be reported since epidemic broke out in China last fall; relapses are another sign of critical need for doctors to develop diagnostic test for SARS; Hong Kong hospitals are releasing patients who no longer show symptoms, with no way to determine whether patients still have virus in their bodies; map (M)",5/1/2003,
1,2003-05-04T05:00:00+0000,China Allows Health Group Into Taiwan In SARS Fight,World,"China, in reversal, approves rare mission by World Health Organization to Taiwan, easing diplomatic logjam that has hindered disputed territory's access to medical assistance even as it fights growing outbreak of SARS; China reports nine new SARS deaths and 181 new confirmed cases, including 114 in Beijing; says that while spread of disease is still rapid, it has stabilized at below 200 new cases each day, more than half of those occurring in Beijing, now hardest-hit city in world (M)",5/4/2003,
2,2003-05-02T05:00:00+0000,Lessons of Anthrax Attacks Help U.S. Respond to SARS,World,"United States government is being given high marks for its aggressive handling of SARS, even by critics who had accused senior health officials of bungling response to last major health emergency, anthrax attacks of Oct 2001; Health and Human Services Sec Tommy G Thompson speaks of 'whole new feeling of responsiveness'; most experts say SARS has been less of challenge than anthrax, which came without warning; SARS first emerged in China, giving American health officials time to prepare; unlike Canada, where single SARS patient infected dozens of others, US has apparently had no such 'super spreaders'; Thompson is leaving nothing to chance; gets daily briefings and has met twice with Pres Bush to discuss epidemic; shares concerns of some experts that SARS could wane in warm months, then come roaring back in fall; drawing (M)",5/2/2003,
3,2003-05-14T05:00:00+0000,China Issues Strict Rules On Reporting Of Disease,World,"China, stung by ruinous effects of initial cover-up on SARS, issues stringent new rules requiring local officials to report disease outbreaks immediately to Beijing or face dismissal or criminal charges; officials report 80 new SARS cases nationwide, but say Beijing epidemic is easing; WHO experts warn numbers could jump again (M)",5/14/2003,
4,2003-04-30T05:00:00+0000,A New SARS Riddle: How to Know It's Beaten,World,Lawrence K Altman analysis of SARS epidemic discusses new WHO assurances that outbreak is over in Vietnam and waning in Hong Kong and question of how much confidence experts can express about little-understood new disease (M),4/30/2003,
5,2003-04-29T05:00:00+0000,SARS IS THE SPARK FOR A RIOT IN CHINA,World,"Thousands of people riot in rural Chinese town of Chagugang after word spreads that four-story school building would be turned into ward for patients suffering from SARS; it takes hundreds of police officers and two busloads of paramilitary troops in riot gear to disperse angry crowds; officials insist school will be used for quarantining people with possible exposure to SARS, not for sick patients; school attack is first reported instance of civic violence directly associated with SARS; more conflict appears possible as China's government--used to treating public, especially in rural areas, in highhanded fashion--applies stringent measures to contain disease and runs up against social tensions and fast-spreading fear of SARS (M)",4/29/2003,
6,2003-05-04T05:00:00+0000,"As SARS Outbreak Took Shape, Health Agency Took Fast Action",World,"Article in Rise of a Virus series says World Health Organization acted as swiftly as it could in face of SARS epidemic, given lack of official candor in China, where disease first erupted in November 2002; notes praise agency has received for showing courage to issue global alert on March 12; photos (L)",5/4/2003,
7,2003-04-30T05:00:00+0000,Stocks Rise in Asia on Hopes That Worst of SARS Is Over,World,"Stock markets rise sharply across East Asia amid hopes that SARS outbreak can be controlled; photo of Hong Kong traders wearing face masks, which are becoming less common on floor of exchange and in streets in city hardest hit by disease; 12 more deaths reported there, bringing total to 150, but there are just 15 new cases (M)",4/30/2003,
8,2003-05-13T05:00:00+0000,Rude Awakening,World,"Analysis: SARS epidemic and its obvious mishandling have badly humbled China's leaders at home and abroad, just months after they seemed to be riding high; scholars say one casualty may be smug complacency many Chinese had developed about country's political system and future; SARS epidemic has exposed with embarrassing clarity--to Chinese people and to world--cost of China's tight political control over information and bureaucracy; it has thrown equally embarrassing spotlight on backward and disorganized state of medical care, especially in countryside, where majority of China's people live; top leaders Hu Jintao and Wen Jiabao have been working to make up for lost time ever since government's remarkable admission of grave mistakes on Apr 20; they are moving visibly around country and filling airwaves with exhortations to defeat epidemic; many scholars and political experts think that as result of SARS disaster, new standard of public disclosure has been set in China; photos (M)",5/13/2003,
9,2003-05-13T05:00:00+0000,China Issues Tough Rules on Reporting Outbreaks,World,"New rules require local officials to report disease epidemics to Beijing immediately, on pain of dismissal or even criminal charges.",5/13/2003,
0,2003-05-05T05:00:00+0000,New Findings On Weapons To Combat Deadly Virus,World,"World Health Organization says that newlaboratory findings support theory that SARS virus can survive up to four days on contaminated household surfaces but that disinfectants like bleach are effective weapons to kill it; findings are important because doctors have determined that people infected with virus can excrete it in large amounts in their stool and urine, raising distinct possibility that less than vigorous hygiene--particularly lack of hand-washing--can lead to spread on surfaces in home and elsewhere (M)",5/5/2003,
1,2003-05-01T05:00:00+0000,May Day in Beijing: Not Everything Is Changed by SARS,World,Revelries in Beijing were badly crimped by the pervasive fear of disease and the city's stringent new controls on public events and touring. But some things remained the same.,5/1/2003,
2,2003-05-05T05:00:00+0000,Cases Thought to Be Relapses Now Seen as Other Conditions,World,"Health officials in Hong Kong say dozen former SARS patients there who were initially thought to have suffered relapses actually had other medical problems; initial report caused international alarm; rate of new SARS cases being reported around world slows somewhat; several governments announce lower daily totals for new cases; Beijing reports 69 new cases, down from 114 day earlier and lowest daily total in last two weeks; Taiwan, which has been posting 8 or 10 new cases a day, has only 2 new cases on May 3 but 14 more on May 4; photo (M)",5/5/2003,
3,2003-05-12T05:00:00+0000,Fight in Taiwan Is Impeded By Resistance to Isolation,World,"In contrast to authoritarian Singapore, Taiwan is model of how hard it can be to set up airtight quarantine in a democracy; authorities in Taiwan are struggling to keep 23,000 healthy people in quarantine in effort to contain SARS; Interior Ministry installs video cameras in quarantined homes and may employ satellite tracking devices, or house offenders in military camps; in and around Taipei, where most cases are, unknown number of people have broken quarantine; angry officials threaten large fines; Taiwan's most infamous quarantine violater, unidentified high school student, is now hospitalized with SARS; photo (M)",5/12/2003,
4,2003-04-26T05:00:00+0000,BEIJING BROADENS SARS QUARANTINE; MORE CASES FOUND,World,"At least 40,000 Beijing residents who have been exposed to SARS are being kept in isolation and second major hospital is put under total quarantine as China struggles to contain epidemic; photos; 103 more cases reported, bringing total in city to 877 confirmed and 954 suspected; WHO team in Shanghai predicts substantial increase from two reported cases as international definitions are applied; Beijing officials hold first press conference to explain measures (M)",4/26/2003,
5,2003-05-11T05:00:00+0000,"In Cambodian Forest, Battling Besieging Spirits",World,"Villagers in Ping, Cambodia, and its mountain neighbor, Bornhok, use tribal rituals to battle nameless disease that has sickened more than 30 of them and killed 7 in an agony of coughing, choking and delirium; none of villagers seem to know just what spirits turned against them or what transgressions they were punishing in northwest mountains of Ratanakiri Province; doctors of Western medicine are also baffled by mystery pulmonary disease, which closely mimicks SARS but, unlike SARS, seems to respond to antibiotics; photos; map (L)",5/11/2003,
6,2003-05-10T05:00:00+0000,"Colleague Ill, So 30 Toronto Hospital Workers Are in Quarantine",World,Thiry health care workers at Mount Sinai Hospital in Toronto are quarantined after hospital administrator comes down with respiratory symptoms that could be SARS(S),5/10/2003,
7,2003-05-03T05:00:00+0000,More Detailed Reports Are Urged to Show Source And Location of Cases,World,"World Health Organization will broaden its reporting standards for SARS, calling on all countries to report not just number of suspected or confirmed cases but also where they were occurring and from whom they were contracted; countries are supposed to have been reporting such information to WHO all along, but many have not, in part because their health workers have been swamped with reporting other details in epidemic; 29 countries and Hong Kong have reported 6,054 SARS cases, including 417 deaths; China and Hong Kong have reported vast majority of cases (M)",5/3/2003,
8,2003-05-02T05:00:00+0000,Illness Brings Subdued May Day in Beijing,World,"May Day revelries in Beijing are sharply curbed by pervasive fear of SARS infection; to discourage travel that might spread disease, government officially shortens national holiday to five days from planned seven; photo of Tiananmen Square, deserted on day when thousands would normally gather to mark most hallowed of Communist holidays (M)",5/2/2003,
9,2003-04-29T05:00:00+0000,East Asia Markets Rise Sharply as SARS Fears Recede,World,Investors gained hope that an outbreak of a deadly respiratory disease could be brought under control.,4/29/2003,
0,2003-04-29T05:00:00+0000,W.H.O. Lifts SARS Warning Against Travel to Toronto,World,The World Health Organization said it was satisfied with local measures to stop the spread of the respiratory illness.,4/29/2003,1
1,2003-04-27T05:00:00+0000,Beijing Hurries to Build Hospital Complex For Increasing Number of SARS Patients,World,"Some 4,000 construction workers, working around clock, rush to erect sprawling hospital complex in Beijing suburb to house at least thousand people who have highly infectious respiratory illness as number of reported SARS cases rises sharply in city; new hospital is latest example of how China has geared up to fight SARS, sealing off entire neighborhoods or factories where infected people live and work, closing public buildings and filling airwaves with advice about hygiene and pleas for calm; disease's growing reach has rattled even some experts; photo (M)",4/27/2003,
2,2003-04-28T05:00:00+0000,Thousands Riot in Rural Chinese Town Over SARS,World,Residents of Chagugang ransacked a building because they believed that it would be turned into a ward for SARS patients.,4/28/2003,
3,2003-04-25T05:00:00+0000,Quarantine Set In Beijing Areas To Fight SARS,World,"China carries out sweeping quarantine of thousands of Beijing residents who have had contact with suspected carriers of highly infectious repiratory illness called SARS, as Communist government begins resolute campaign to combat national health crisis; isolation orders are imposed on homes, factories and schools where people with SARS symptoms live, work or study; Communist Party cells in work units and neighborhoods ferry food and other basic necessities to people confined to their homes, while monitoring them to ensure they do not flee; white-and-yellow crime-scene tape is wrapped around city block in northwestern Beijing, sealing more than 2,000 health workers and patients inside Beijing Univ People's Hospital complex where more than 70 staff members are suspected of having SARS; new measures are contributing to growing sense of alarm around capital; reported deaths and infections continue to rise sharply; crowds of temporary laborers descend on major train stations seeking emergency passage out of city; Beijing now has total of 774 confirmed SARS patients; this figure is nearly 20 times higher than what Beijing was reporting five days ago, before central government fired two top officials and vowed to begin to report accurately; photo of masked Beijing shoppers stocking up on food (L)",4/25/2003,
4,2003-04-26T05:00:00+0000,"Can SARS Be Stopped? Experts Differ, but Fear a Third-World Epidemic",World,Lawrence K Altman analysis of question of whether spread of severe acute respiratory syndrome can be stopped and the disease eradicated from the world (L),4/26/2003,
5,2003-05-01T05:00:00+0000,"Now Waning, Illness Takes Political Toll In Canada",World,"Political fallout in Canada from SARS epidemic is just beginning, day after World Health Orgn lifts its travel warning on Toronto; two top Liberal Party contenders to succeed retiring Prime Min Jean Chretien suggest country is politically adrift at time when 23 people have died from disease and nearly 150 more have gotten ill; government's critics say country could have avetrted WHO travel advisory, which cost Canada hundreds of millions of dollars in lost business and tourism, had it simply taken WHO advice weeks ago to tighten airport screening to assure that no one with SARS symptoms left country (M)",5/1/2003,
6,2003-05-01T05:00:00+0000,"As Cases Mount, Chinese Officials Try to Calm a Panicky Public",World,"New Beijing Acting Mayor Wang Qishan calls SARS epidemic severe and uncontrolled as he seeks to convince panicky public that battle against disease has been effectively joined at last; was summoned to Beijing 10 days ago after Mayor Meng Xuenong was fired for his part in covering up city's surging epidemic; Wang is showing new face of candor that China's leaders have adopted after months of denial led to medical and diplomatic disasters; he admits city has been sadly unprepared for SARS, had misled public about its spread and now faces shortage of qualified hospitals and medical staff; many Beijing residents say they are encouraged by his statements, but strong undercurrents of anger and mistrust remain; reported cases of disease in capital climb by another 101, to 1,440; photo (M)",5/1/2003,
7,2003-04-28T05:00:00+0000,"With Virus at Gate, the Drawbridge Is Up",World,"Many villages surrounding Beijing build makeshift barricades and post sentinels to keep out strangers, in desperate if not always well-informed attempt to fend off contagion of SARS; total number of cases of SARS in Beijing is now 1,114, with 56 deaths; photo (M)",4/28/2003,
8,2003-04-30T05:00:00+0000,The Contagion Reaches Near the Top of the Chinese Communist Hierarchy,World,SARS epidemic that may have emerged from teeming markets of Guangzhou has quickly mutated into threat to China's Communist Party elite in Beijing; several business executives and senior officials have come down with respiratory ailment and authorities have quarantined unknown number of people inside leadership compound; outbreak may have influenced government's abrupt shift to more aggressive battle against SARS; photos (M),4/30/2003,
9,2003-04-30T05:00:00+0000,ADVICE TO PUT OFF TRIPS TO TORONTO IS LIFTED BY W.H.O.,World,"World Health Organization lifts week-old advisory against nonessential visits to Toronto, citing ebb in SARS outbreak there; decision is welcomed by Canadian officials, who disputed contention that city became source of outbreaks outside Canada, but reversal raises question of whether WHO yielded to intense pressure from influential country; 21 people have died in Toronto but no new cases have been reported since April 9 in general community or since April 20 in hospital system; city still has 39 active cases and 398 people in quarantine; WHO chief Dr Gro Harlem Brundtland defends original advisory and shift, warning decision could be changed again; photo; China reports 389 new cases; Dr Julie L Gerberding of Centers for Disease Control tells Senate panel US has 52 probable cases, nearly all involving travel to affected countries; Canada agrees to use infrared temperature machines to screen departing international passengers at Toronto and Vancouver airports; setback to Canadian economy and Prime Min Jean Chretien's personal lobbying of Brundtland noted (M)",4/30/2003,1
0,2003-04-25T05:00:00+0000,"To Broad Support, Hong Kong Police Take On an Expanded Role in Fighting SARS",World,Government of Hong Kong is assigning broad and expanding role to police in effort to fight spread of infectious disease SARS; officers are taking computer software designed for major criminal investigations and instead entering information on family members and other close contacts of people with SARS; other officers pay three visits daily to homes of people ordered not to go out because someone in their household has confirmed case of disease; new confinement orders are issued for household members of suspected SARS patients as well; tougher measures appear to have broad support in populace terrified of disease that is still infecting 200 more people and killing two dozen each week; photo (M),4/25/2003,
1,2003-04-25T05:00:00+0000,"4,000 Quarantined in Beijing as Suspected SARS Cases Climb",World,"A second major hospital was put under total quarantine, with virtually no one allowed to enter or leave.",4/25/2003,
2,2003-04-29T05:00:00+0000,Toronto Officials Seek End to Travel Advisory,World,Senior Canaidan health officials travel to Geneva to try to persuade World Health Orgn to retract advisory asking visitors to put off unnecessary travel to Toronto; are bringing fresh evidence that SARS epidemic in city is subsiding; 267 people have been stricken with SARS and 21 of them have died since single Chinese immigrant brought mysterious disease to Toronto two months ago; graph (M),4/29/2003,
3,2003-04-23T05:00:00+0000,SARS Cases In Hong Kong Have Begun To Level Off,World,"Health officials report number of people infected with severe acute respiratory syndrom has leveled off in Hong Kong in last week, although disease is unlikely to be eradicated soon, if ever; Hong Kong still has two to three dozen new cases a day and almost as many people hospitalized with SARS as rest of world; area's number of hospitalized probable SARS cases peaked at 960 and has since fallen 9 percent; 34 SARS patients have died, most of them elderly; tentative signs are emerging that residents are accepting SARS as manageable risk and moving on with daily lives; graph of hospitalized patients; photo (M)",4/23/2003,
4,2003-04-29T05:00:00+0000,W.H.O. Says Outbreak Is Fading in Vietnam and 3 Other Places,World,"World Health Orgn lifts its advisory against travel to Vietnam and says SARS infections appear to be dwindling in Singapore, Canada and Hong Kong; warns that disease is still spreading in China; Taiwan, prevented from joining WHO because of Beijing's objections, has also reported growing number of cases; Vietnam, one of first countries outside China to suffer outbreak, has not had any new cases in 20 days, thought to be twice disease's incubation period; Canada has reported no new cases outside hospitals for last 10 days, and is lobbying for WHO to lift its advisory against travel to Toronto; China posts 203 more cases, bringing its total to 3,106; photo (M)",4/29/2003,1
5,2003-04-27T05:00:00+0000,Focusing One Hospital's Resources on One Disease,World,"Singapore has designated 1,000-bed hospital for SARS, disease that spreads so readily in closed spaces that patients are evaluated outside, in tent; hospital got its first case Mar 1, before disease was known, and many doctors fell ill; hospital now uses four specially ventilated rooms for each patient to insure isolation; medical staff wears special protective garb; photos (M)",4/27/2003,
6,2003-04-29T05:00:00+0000,Health Group Relies on a Time-Tested Rule to Determine Last New Case,World,World Health Orgn is relying on time-tested rule of thumb used by epidemiologists in declaring Vietnam first country to stop its outbreak of SARS; rule says epidemic is over if no new cases occur in time span that is double longest known incubation period of the disease; SARS has 10-day incubation period and no new cases have been detected in Vietnam in 20 days; Vietnam had total of 63 cases and 5 deaths; WHO spokesman gives credit for Vietnam's success to old-fashioned infection-control measures; says there was high level of political commitment there from beginning (M),4/29/2003,
7,2003-04-21T05:00:00+0000,China Admits Underreporting Its SARS Cases,World,"Chinese government admits that cases of dangerous new respiratory disease SARS are many times higher than previously disclosed; announcement comes in unusual nationally televised live news conference by Deputy Health Min Gao Qiang, who says that as of Apr 18, Beijing had 339 confirmed cases and additional 402 suspected cases of disease; new numbers bring total of confirmed cases on mainland China to 1,807, highest of any country; of these, 79 have ended in death; government also announces that weeklong national May Day vacation has been reduced to one day to discourage people from traveling and further spreading disease; photo (M)",4/21/2003,
8,2003-04-27T05:00:00+0000,"From China's Provinces, a Crafty Germ Breaks Out",World,"Article traces rise of corona virus that causes severe acute respiratory syndrome in Guangdong, China, province known for exotic cuisine prepared from freshly killed beasts; unusually high percentage of early SARS victims were in catering profession, offering possible clue to how germ that most resembles chicken and rodent viruses gained ability to infect humans; first victims became ill in Dec; alarmed health departments in three Guangdong cities reported strange pneumonia clusters in early Jan to provincial authorities, who concluded that they were facing highly infectious pneumonia caused by previously unknown agent; disease spread until mid-Mar before Italian doctor working in Hanoi, Vietnam, alerted World Health Organization; doctors were placing SARS patients during period in ordinary wards, exposing health workers and others; map; chronology of events; photos (M)",4/27/2003,
9,2003-04-28T05:00:00+0000,Outbreak of Disease Brings Big Drop-Off In China's Economy,World,"Outbreak of new respiratory disease SARS inflicts greatest blow to Chinese economy since Tiananmen Square killings in 1989, causing plunge in retail sales, slump in demand for some Chinese exports and near-collapse in domestic and foreign tourism; Chinese economy has gone from expanding at annual rate of 9.9 percent in first quarter to shrinking at annual rate of 2 percent in second quarter, according to estimates from J P Morgan Chase; economic damage is being increased by some government policies adopted to slow spread of SARS, such as ordering closing of all movie theaters, Internet cafes and other places of entertainment in Beijing, or refusing entry to tour groups in Guangdong Province; if current economic downturn proves prolonged, it could damage Communist Party's claim to be best way to offer greater prosperity to 1.3 billion Chinese; photos; graph (L)",4/28/2003,
0,2003-04-27T05:00:00+0000,"In Toronto, Ballplayers Who Worried Now Wash",World,Severe acute,4/27/2003,
1,2003-04-23T05:00:00+0000,W.H.O. Adds Toronto to List of Cities to Avoid Because of SARS,World,"With the disease spreading every day and a 15th person in Toronto dying of the ailment today, what once looked like a model plan appears to have been shattered.",4/23/2003,1
2,2003-04-23T05:00:00+0000,Hong Kong Earmarks $1.5 Billion to Deal With Effects of SARS,World,The plan calls for government spending and tax cuts concentrated in the next four months that will equal 1 percent of the territory's entire annual economic output.,4/23/2003,
3,2003-04-25T05:00:00+0000,Possible Next Patient: The Chinese Leadership,World,"Analysis: political fortunes of Pres Hu Jintao may by held hostage to course disease SARS takes in China, regardless of how brilliantly or boldly he and Prime Min Wen Jiabao mount their belated counterattack; in crisis of this potential magnitude, grip of Communist Party itself could be shaken; some say SARS may undermine public faith to near-fatal degree and force rulers to share information more freely (M)",4/25/2003,
4,2003-04-26T05:00:00+0000,Hong Kong Doctor's Ordeal As Patient With New Disease,World,"Article on Hong Kong cardiologist Yu Cheuk-man's long life-and-death struggle to survive SARS; Yu, 37-years-old and physically fit, is one of 18 students and dozen other professors who contracted disease in March from patient at Prince of Wales Hospital; he describes ordeal and continuing rehabilitation; photo; chronology (M)",4/26/2003,
5,2003-04-26T05:00:00+0000,Canada Increases Pressure on World Health Organization to Lift Travel Advisory,World,Prime Min Jean Chretien protests World Health Organization's advistory for travelers to avoid Toronto because of outbreak of highly contagious respiratory disease known as SARS; will spend evening at hotel in city to show how safe he feels it is; Canadian officials express optimism about controlling disease; photos (M),4/26/2003,
6,2003-04-25T05:00:00+0000,Toronto Mayor Calls for Understanding From Businesses and Consumers,World,"Toronto Mayor Mel Lastman scrambles to counteract mounting economic damage caused by mysterious respiratory disease SARS; pleads with businesses not to lay off workers and with banks to allow customers to defer payments on mortgages and loans; World Health Organ rejects Canadian government appeals to reverse its Apr 22 advisory that travelers defer visiting Toronto because of outbreak of SARS; it has killed 16 people in Toronto in last seven weeks; there have been 257 probable and suspected cases; no new cases are reported over last two days, leading some public officials to say crisis is easing; WHO advisory will have strongly negative impact on entire Canadian economy; photos (M)",4/25/2003,
7,2003-04-25T05:00:00+0000,"Citing Illness, China Decides To Postpone Soccer Season",World,"China postpones start of season for its men's and women's professional soccer leagues as severe acute respiratory syndrome (SARS) continues to disrupt international sports; delay cast further uncertainty on largest international sporting event for women, soccer World Cup, which is scheduled from Sept 23 to Oct 11 in four cities of east-central China; Major League Baseball's executive vice president Sandy Alderson says he would travel to Toronto to signal confidence in decision to continue playing games there despite death of 16 people from SARS; says his organization is comfortable about teams going to Toronto without great risk, in spite of WHO travel advisory (M)",4/25/2003,
8,2003-04-25T05:00:00+0000,Canadian Strain of Virus Appears to Be Stronger Than the U.S. Variety,World,"Dr Robert Webster, leading American virologist, says death rates from SARS illness may vary among countries, in part because of differences in strains of the virus; has just returned from advising Hong Kong officials on epidemic there; says one reason United States has escaped Canada's difficulties with disease is that there is more virulent strain in Canada than one seen so far in US; says outbreak of SARS in apartment complex in Hong Kong seems to be caused by different strain from one causing illness elsewhere in Hong Kong; says there are likely to be many strains of SARS virus, and how big a global problem disease becomes depends on evolution of virus; photo (M)",4/25/2003,
9,2003-04-24T05:00:00+0000,Epidemic Spurs Plan To Revive Hong Kong,World,"Hong Kong officials address economic fallout of SARS epidemic, announcing $1.5 billion package of tax breaks, loan guarantees for businesses and creation of 21,500 short term jobs, half of which will involve cleaning and disinfection effort to combat disease; plan calls for government spending and tax cuts concentrated in next four months that will equal one percent of territory's annual economic output; measure comes just seven weeks afer government announced higher taxes and deep spending cuts to reduce enormous budget deficit (M)",4/24/2003,
0,2003-04-22T05:00:00+0000,Reported SARS Cases in Beijing Take Sharp 2-Day Jump,World,Reported cases in Beijing of SARS climbed by 249 to 588 as the government continued its belated campaign to give honest figures.,4/22/2003,
1,2003-05-02T05:00:00+0000,World Briefing | Europe: Ireland: Town Bars Hong Kong Visitors,World,"SARS outbreak prompts Clonmel Town Council in Tipperary County, Ireland, to withdraw invitation to host Special Olympics Hong Kong delegation to games slated for June in Dublin; Irish Health Minister Michael Martin criticizes decision as premature and Prime Minister Bertie Ahern is looking into possible quarantines for some visitors to games (S)",5/2/2003,
2,2003-04-20T05:00:00+0000,SARS Precautions Spread Into Toronto Church Services,World,The people of Toronto filled their churches over the Easter weekend in an expression of faith over fear despite the spread of a mysterious respiratory disease.,4/20/2003,
3,2003-04-17T05:00:00+0000,"In U.S., Fear Is Spreading Faster Than SARS",World,"Fear about SARS, mysterious respiratory disease first reported in China, spreads throughout United States even though no one in America has died from disease; American health officials see only limited local transmission in nation, and number of probable or suspected cases in US is expected to be lowered from 199 to about 30 because of tighter definition of the disease; health officials and community leaders say some of highest levels of anxiety are being reported in states like New York, California and Washington, with most SARS cases or sizeable Asian-American communities; say Asian immigrant communiites are more attuned to what is going on in Hong Kong and China, where they have family and business ties; say trans-Pacific travel, calls and e-mails blur distinction between what happens here and what happens there; in New York City, Mayor Michael R Bloomberg has lunch at restaurant in Chinatown and then holds news conference to emphasize that fear of SARS is hurting business in neighborhood; photos (L)",4/17/2003,
4,2003-04-24T05:00:00+0000,Illness's Psychological Impact in China Exceeds Its Actual Numbers,World,"Threat of SARS is virtually only topic of conversation in Beijing, city of 14 million where reported cases of disease surge by another 105, bringing total to 693; throngs of residents, driven by rumors of possibly draconian quarantines, stock up on supplies or head for provinces; World Health Organization adds Beijing, along with Shanxi Province, to list of places where nonessential travel should be avoided; experts warn that hundreds of more cases are likely inevitable as government belatedly struggles to contain outbreak it until recently tried to conceal; schools in Beijing are shut down for at least next two weeks, step that may be prudent but adds to public's anxiety; over all, China has 2,305 confirmed cases and 96 patients have died; international experts question credibility of persistently low totals reported in some regions, and WHO team is investigating Shanghai, where only two cases have been officially reported; 1,458 cases have been reported in Hong Kong and 1,330 in Guangdong Province, where disease was first detected but where number of people currently sick is estimated at less than 200; map illustrates distribution of cases throughout China; photo (M)",4/24/2003,
5,2003-04-23T05:00:00+0000,Chinese Capital Closes Schools for at Least Two Weeks,World,"Beijing, in strongest action yet against SARS outbreak, closes all primary and secondary schools until at least May 7 and tells students to study at home, using newly improvised online educational service; orders teachers to report to schools to assist students who choose to come and study on own and to use Internet to post assignments and review materials; officials say entrance exams may have to be postponed; fearful parents in many parts of city have kept children home since disclosure that respiratory disease outbreak is larger than previously announced; photo (M)",4/23/2003,
6,2003-04-24T05:00:00+0000,Health Officials Tell Visiting Major League Teams to Take Precautions in Toronto,World,Major League Baseball will begin recommending that teams traveling to Toronto to play Blue Jays undertake variety of precautions to protect themselves from outbreak of severe acute respiratory syndrome (M),4/24/2003,
7,2003-04-18T05:00:00+0000,"Fearing SARS, Ontario Urges Wider Quarantines",World,"Ontario health officials take extraordinary step of asking anyone with even one symptom of SARS to stay home for few days to avoid possibly spreading severe respiratory ailment during Easter holiday weekend; Public Safety Commissioner Dr James Young and Health Min Tony Clement explain; Canada, particularly Toronto, is hardest-hit country outside Asia: 12 of 126 cases have been fatal, death rate of 9.5 percent; Toronto area cases traced to Scarborough Grace Hospital; outbreak centers on Philippines-based Bukas-Loob Sa Diyos Covenant Community, Roman Catholic group; Pennsylvania may now have SARS case in patient who attended religious meeting in Toronto on March 28 (M)",4/18/2003,
8,2003-04-24T05:00:00+0000,"Virus Proves Baffling, Turning Up in Only 40% of a Lab's Test Cases",World,"Canada's National Microbiology Laboratory finds virus for severe acute respiratory syndrome in only 40 percent of probable and suspected cases, suprisingly low rate; additionally, portion of recent cases testing positive for virus is declining, and a number of people who are not suspected of having SARS are testing positive; director Dr Frank Plummer says findings have potential to weaken link in Canada between SARS and the previously unknown member of coronavirus family that World Health Organization has said is cause of SARS; stresses he is not challenging WHO's conclusion, but finds results 'weird'; WHO says it continues to believe that new coronavirus is cause of SARS, but is following research developments (M)",4/24/2003,
9,2003-04-18T05:00:00+0000,Criticism Mounts in Ontario Over Handling of SARS Cases,World,The second-guessing is now blooming faster than the disease and it is beginning to jeopardize business confidence and become a rancorous political issue.,4/18/2003,
0,2003-04-18T05:00:00+0000,Criticism Mounts in Ontario Over High Rate of SARS Cases,World,The second-guessing is now blooming faster than the disease and it is beginning to jeopardize business confidence and become a rancorous political issue.,4/18/2003,
1,2003-04-28T05:00:00+0000,W.H.O. Lifts Vietnam Advisory,World,"The World Health Organization said that SARS infections appeared to be dwindling in 3 other nations, but still rising in China.",4/28/2003,1
2,2003-04-21T05:00:00+0000,"Toronto, Hard Hit by Mystery Illness, Warily Celebrates Easter",World,"Churches in Toronto are filled for Easter but handshakes are avoided and communion rituals abridged in effort to help avert full-blown epidemic of severe acute respiratory syndrome in city; Sunnybrook Hospital, one of city's principal trauma centers, is forced to close its SARS and critical care units when four staff members show symptoms of disease; government also has requested that anyone suffering from even single symptom of SARS stay at home; more than 7,000 people have been put in 10-day quarantines over last month (M)",4/21/2003,
3,2003-04-17T05:00:00+0000,Health Group Certain of Agent in Respiratory Ailment,World,"World Health Orgn says animal experiments prove conclusively that agent causing severe acute respiratory syndrome is new member of coronavirus family; says it will be called SARS virus; discovery of SARS virus and proof of its role in causing disease come with astounding speed, after monthlong hunt; Dr David L Heymann, executive director of WHO's communicable diseases program, attributes speed of his agency's success to willingness of members of network to put aside usual competitiveness to develop extraordinary degree of cooperation at time of public health emergency; urgency is underscored by explosive nature of SARS virus; one patient can transmit virus to infect large numbers of other people, particularly health care workers (M)",4/17/2003,
4,2003-04-17T05:00:00+0000,"Virus Badly Underreported in Beijing, W.H.O. Team Finds",World,"Team of international medical investigators says Chinese authorities have significantly understated prevalence of severe acute respiratory syndrome in Beijing, with cases easily surpassing total of 37 officially reported; World Health Orgn official Alan Schnur, who is leading team, guesses that number is closer to 100 to 200 cases; says that would not constitute out-of-control outbreak in city of 13 million people, but systems for surveillance, investigating and reporting SARS cases are not good enough to allow for calculation of epidemic's future course; expresses belief that with more extensive and determined control measures that are now starting, Beijing could avoid infection on scale of Guangdong Province; photos (M)",4/17/2003,1
5,2003-04-24T05:00:00+0000,World Briefing | Europe: Ireland: Special Olympics Are On,World,"Mary Davies, Special Olympics Chief Executive, reports games scheduled for Dublin (Ireland) this June will proceed, in spite of concerns over spread of SARS; fewer than 200 of 7,000 people participating hail from countries hardest hit by SARS (S)",4/24/2003,
6,2003-04-20T05:00:00+0000,Mongolian Capital Is Subdued by Illness Scare,World,"Fear of SARS reaches Ulan Bator, Mongolia, after Health Ministry announces that five suspected cases of illness were admitted to National Center for Communicable Diseases; no confirmed cases have been found in Mongolia yet, but authorities have virtually locked down country to stave off outbreak; photo (M)",4/20/2003,
7,2003-04-20T05:00:00+0000,No Headline,World,"Health officials around the world have broad power to declare quarantines to stop spread of SARS, but they must act cautiously because quarantines can backfire, driving infected people underground; shutting borders can cause economic disruption, and pursuing individual carriers often makes more epidemiological sense; map shows spread of SARS; photo (M)",4/20/2003,
8,2003-04-19T05:00:00+0000,China's Top Leaders Urge Tough Action on Illness,World,"China's top leaders, seeking to quell international uproar over credibility of their medical reports and to halt spread of dangerous new virus, hold urgent meeting on severe acute respiratory syndrome and warn officials not to withhold data on disease; Pres Hu Jintao heads meeting, putting personal stamp on directives; publicity about SARS and infection-control efforts in Beijing have increased in recent days; Chinese media have not reported World Health Organization findings that Beijing might have up to 200 SARS cases, not 37 officially reported (M)",4/19/2003,
9,2003-04-19T05:00:00+0000,Disease Has Canada Doubting Its Leaders,World,Ontario health officials brace for wider outbreak of severe acute respiratory syndrome around Toronto as criticism mounts that political and health care officials made key errors; recent reports suggest officials were slow to isolate new cluster of patients in prayer group and that several stricken patients were inexplicably turned away at several hospitals while they potentially infected many others; second-guessing is beginning to jeopardize business confidence and become rancorous issue in provincial legislature; photo (M),4/19/2003,
0,2003-04-18T05:00:00+0000,A Reticent China Undercuts Its Milder New Image,World,"News analysis on how China's reluctance to reveal data on SARS has undermined five years of diplomacy intended to alter country's image and improve relations with other Asian nations; secrectiveness also reflects China's emphasis on social stability above individuals' well-being; leaders have now pledged to tackle severe new respiratory disease, but still insist China should not be treated as source of SARS; photo (M)",4/18/2003,
1,2003-04-18T05:00:00+0000,One Airline's 5 Weeks With a Medical Threat,World,Northwest Airlines' effort since March 15 to keep on top of rapidly emerging respiratory disease SARS reviewed; airline has crisis team that gets updates on spread of SARS and has ordered preventive measures such as wiping down ticket counters and allowing employees to wear masks and gloves; Northwest is particularly vulnerable as one of two major US airlines serving Asia; United declines to discuss procedures (M),4/18/2003,
2,2003-04-16T05:00:00+0000,Exposure of Church Group to Disease Raises Chance of Its Spread in Toronto,World,"Expectations that severe acute respiratory syndrome could be spreading to Toronto population at large increase significantly with news that 500 members of church group were exposed to disease March 28 and may have passed it to others; most people in city have taken disease in stride, at least so far, using mass transit and attending parties and public events without wearing kinds of masks that are now common in some Asian cities (M)",4/16/2003,
3,2003-04-16T05:00:00+0000,Experiments on Monkeys Zero In on the Cause of a Mysterious Disease,World,Dr David L Heymann of World Health Organization says that monkeys experimentally infected with new coronavirus have developed illness similar to mysterious human respiratory disease SARS and that it is now almost certain that coronavirus causes disease; verifying cause of SARS is essential for development of reliable diagnostic tests to determine who has disease so that affected patients can be treated in isolation and those who are not affected can carry on with their normal activities; photo (M),4/16/2003,
4,2003-04-16T05:00:00+0000,Experts Say China Has Greatly Underestimated Virus Cases,World,"Cases are possibly now in the range of 100 to 200 rather than the 37 that were officially reported on Monday, authorities said.",4/16/2003,
5,2003-04-16T05:00:00+0000,Persuading Big Business To Help Look For a Vaccine,World,"Federal government is trying to enlist drug makers and biotechnology companies in search for drugs and vaccines to fight SARS, respiratory illness that has sickened thousands of people and killed 154, but may run into same problems it has been having trying to recruit companies to develop defenses against bioterrorism agents; drug companies have not become involved in biodefense efforts because it is unclear how big overall market will be for such drugs and vaccines; may be similarly reluctant to take on 5- or 10-year research program for SARS, which may turn out to be self-limiting epidemic (M)",4/16/2003,
6,2003-04-16T05:00:00+0000,Apprehension Deters Buyers From Attending China Fair,World,"China's main trade fair, which usually attracts tens of thousands of buyers from around world, opens in Guangzhou with nearly empty halls, as most of customers stay home out of fear of SARS, new respiratory disease; first known cases of disease occurred in November in Foshan, city on Guangzhou's outskirts; photo (M)",4/16/2003,
7,2003-04-15T05:00:00+0000,Centers for Disease Control Becomes 2nd Agency to Map Genome of Mystery Infection,World,"Centers for Disease Control and Prevention becomes second group to fully map genome of virus most suspected of causing mysterious respiratory disease known as SARS; Dr Julie L Gerberding, centers' director, calls confirmation 'critically important' step in speeding up attempts to develop reliable test to detect new virus, and possibly to eventually develop effective antiviral drugs and vaccine; photo (M)",4/15/2003,
8,2003-04-15T05:00:00+0000,Intense Hunt Is On to Find Existing Drug That Works,World,"Scientists who are almost certain they have found virus that causes SARS launch breakneck effort to develop vaccine and drugs to prevent and treat disease; scientists at United States Army's biodefense laboratory in Fort Detrick Md, in cooperation with other federal agencies, are screening up to 2,000 approved and experimental drugs in hopes of finding medicine that will inhibit growth of virus in laboratory cultures; if one is found it would accelerate development of drug to treat SARS; developing drug from scratch would take years; genetic sequencing of virus, just completed by Canadian scientists and now by Americans, is expected to provide many clues about how armor of virus can be pierced (M)",4/15/2003,
9,2003-04-15T05:00:00+0000,Cases of Lethal New Illness Rise Sharply in Interior Region,World,"Report last week that 32 people in China's Shanxi Province have been diagnosed with severe acute respiratory syndrome (SARS) heralds possible spread of disease through country's vast, medically underserved hinterlands; until now disease has been concentrated in prosperous, urbanized southeastern province of Guangdong and in neighboring Hong Kong, with small numbers of cases appearing in other Chinese cities; worry deepens when Chinese ministry of health reports 47 more cases in Shanxi; Shanxi cases are concentrated in provincial capital of Taiyuan, where SARS was apparently introduced several weeks ago by traveler returning from Guangdong; World Health Orgn team seeking to clarify situation in Beijing is making what team members describe as slow, steady progress; say they have still not gained access to any of city's military hospitals; photo; map (M)",4/15/2003,
0,2003-04-15T05:00:00+0000,World Briefing | Europe: Ireland: Doctors Strike,World,Three-hundred Irish public health doctors strike for better pay and working conditions; strike temporarily halts tracking of infectious disease SARS (S),4/15/2003,
1,2003-04-16T05:00:00+0000,The Microbe Test,World,"Koch's postulates, testing process devised in 1890 by German bacteriologist Robert Koch, allows scientists to determine whether particular microbe causes particular disease (S)",4/16/2003,
2,2003-04-15T05:00:00+0000,One-Day Death Rate From New Virus Hits 9 in Hong Kong,World,The toll in Hong Kong from severe acute respiratory syndrome set a new single-day record.,4/15/2003,
3,2003-04-14T05:00:00+0000,The Internet Is Awash in Ads for Products Promising Cures or Protection,World,"Federal health officials warn consumers to be wary of advertisements on Internet for products claiming to prevent SARS; Food and Drug Administration Comr Mark B McClellen says risk of contracting disease in United States is 'very, very low,' and there is no evidence that any specific drug is effective against it; photos (M)",4/14/2003,
4,2003-04-14T05:00:00+0000,Youth and Fitness Offer Little Defense Against Disease,World,"Health officials in Hong Kong report that new respiratory disease known as SARS is beginning to kill younger and healthier adults as well as older people, as medical treatments are proving somewhat less effective than originally hoped; efforts to harvest serum from patients who have recovered from disease and inject it into those still suffering, in hope that serum will contain antibodies, have run into safety problems; World Health Orgn says SARS has hit Hong Kong harder than anywhere else, for reasons that remain unclear; it has three-fifths of world's current SARS patients, although questions have been raised about veracity of mainland China's figures; photo (M)",4/14/2003,
5,2003-04-14T05:00:00+0000,Unions Recommend That Members Be Cautious,World,"Officials at nation's airlines say cleaning methods they have in place are already sufficient to rid aircraft of mystery repiratory illness SARS, even if infected passenger is found on board; airline unions recommend that their members take even more stringent action to protect themselves against SARS; issue is coming under scrutiny because of fears that SARS is being spread around world by air travelers; photo (M)",4/14/2003,
6,2003-04-14T05:00:00+0000,Reports of Virus Jump Sharply in China,World,The reported jump in cases heralded the possible spread of the dangerous pneumonia through the country's vast hinterlands.,4/14/2003,
7,2003-04-14T05:00:00+0000,Lab Decodes Genes Of Virus Suspected In Lethal Outbreak,World,"Scientists in Canada say they have broken genetic code of virus suspected of causing severe acute respiratory syndrome (SARS); say genome appears to be that of 'completely new' coronavirus unrelated to any known human or animal viruses; sequencing genome is first step toward developing diagnostic test for virus and possibly a vaccine; Canadian team slaved over problem 24 hours a day for six days until computers at British Columbia Cancer Agency completed sequencing genome; competing United States team at Centers for Disease Control and Prevention is reaching same conclusion; scientists from both teams say virus's startling novelty could make it harder to trace what animal or bird it came from, if it did jump from another species (M)",4/14/2003,
8,2003-04-13T05:00:00+0000,W.H.O. Team Visits Hospital in Beijing to Investigate Disease,World,"World Health Organization team visits Beijing hospital in effort to clear up swirl of questions and rumors about prevalence of respiratory illness SARS in city; only 22 cases of disease and 4 deaths from it have been publicly recorded in city, but figures for Beijing and several other Chinese cities have been widely questioned, and WHO officials describe uncertainty about course of SARS in China as major global worry (M)",4/13/2003,1
9,2003-04-13T05:00:00+0000,Mystery Illness Changes Life of Hong Kong Doctor,World,"Dr Justin Wu, Hong Kong doctor in front lines in fight on SARS, changes his life in host of ways, even minimizing contact with his wife, in order to avoid catching disease and unwittingly passing it on to others; caring for very sick people while running constant risk of deadly infection takes emotional toll on health workers like Wu; Wu suspects he himself contracted a very mild case of SARS; photo (M)",4/13/2003,
0,2003-04-12T05:00:00+0000,Virus Called Mostly Under Control,World,"World Health Organization says Severe Acute Respiratory Syndrome epidemic seems under control in most countries, although too little is known about its spread in China; says epidemic has peaked in China's Guangdong Province, where it may have originated in Nov; says its global alert one month ago allowed nations with SARS cases imported from Asia to contain threat of local transmission; cases continue to be reported in Hong Kong among health care workers and hospitals are overwhelmed with patients; photo (M)8",4/12/2003,
1,2003-04-12T05:00:00+0000,Hong Kong Tries to Allay Fears Outsiders Have About Its Citizens,World,"Hong Kong officials struggle to persuade other nations not to ban entry of travelers from Hong Kong because of severe acute respiratory syndrome; chief executive Tung Chee-hwa says family members of SARS victims will not be allowed on departing flights, news conference; says territory will work with airlines to develop system to take temperature of ticketholders and refer feverish passengers to doctors at airport; three elderly people fall sick at home for aged despite extra efforts to protect aged, who are more likely to die from SARS than younger patients; photo (M)",4/12/2003,
2,2003-04-12T05:00:00+0000,U.S. Diplomats Are Leaving Overseas Posts,World,"Combination of war in Iraq, terrorist threats and spread of respiratory disease SARS results in largest withdrawal of American diplomats from overseas posts since Persian Gulf war in 1991; State Dept has evacuated total of 1,400 diplomats and their dependents from 17 countries in recent months; number could surge, depending on spread of SARS in some countries; withdrawals raise questions about government's ability to use private and public diplomacy to improve relations with nations shaken by war in Iraq (M)",4/12/2003,
3,2003-04-11T05:00:00+0000,Federal Agency Issues Guidelines On Handling Infected Students,World,"Centers for Disease Control and Prevention issues first guidelines for school administrators and health officials in determining what to do if student has SARS, mysterious respiratory disease; says students who have been exposed to SARS but do not have symptoms--fever, cough, sneezing--should be allowed to attend school, but should be vigilant for onset of symptoms; CDC says that SARS has not so far been transmitted from affected individuals to other people through casual contact in schools or public gatherings in US (M)",4/11/2003,
4,2003-04-11T05:00:00+0000,Hong Kong Resists Wide Quarantine for Mystery Illness,World,"Hong Kong officials are strongly resisting kind of broad quarantines that other countries have imposed, despite growing international pressure to halt spread of new respiratory disease there; two weeks ago Hong Kong ordered only people sharing households with SARS patients to stay home for 10 days; new rules will involve unannounced visits by police to homes of those family members to make sure they do not go out; calls for tighter restrictions are growing; there is growing view among many doctors in Hong Kong that quarantine would not work; photo (M)",4/11/2003,
5,2003-04-11T05:00:00+0000,Carrier of New Virus Made 7 Flights Before Treatment,World,"Hong Kong Dept of Health officials say that man infected with new respiratory disease called SARS flew from Hong Kong to Munich, Barcelona, Frankfurt, London, Munich again, Frankfurt again and then back to Hong Kong before entering hospital; appeal for passengers and air crews from all seven flights, which were all on Lufthansa, to consult medical professionals; it is not known whether man, who is 48, has infected anyone else on flights; despite assurances from airlines about filters aboard modern planes, at least 13 people have fallen ill with SARS so far after sharing flight from Hong Kong to Beijing last month with elderly man who had been infected while visiting his brother in hospital in Hong Kong; travelers are continuing to board planes while feeling ill despite strenuous warnings from World Health Orgn and national health agencies that they not do so (M)",4/11/2003,
